,Unnamed: 0,2013,2014,2015,2016,2017,2018,2019,2020,2021,2022
0,Lưu chuyển tiền thuần từ các hoạt động sản xuất kinh doanh,7552107195.0,17022562923.0,19505520528.0,20392607366.0,-1348278244.0,-11144288260.0,-4706086010.0,8024174475.0,-15916663244.0,5206247279.0
1,Lãi/lỗ trước những thay đổi vốn lưu động,6977607045.0,17304438326.0,19985802897.0,17866300123.0,15332547072.0,15032810837.0,23837482864.0,33102537791.0,15090081790.0,13694256639.0
2,Lãi trước thuế,-8077310441.0,2497390204.0,11364772239.0,14749613328.0,15400208745.0,12775049570.0,21843506712.0,28943145537.0,7734383721.0,1619890174.0
3,Khấu hao TSCĐ,6554582055.0,5355322766.0,4467025094.0,4147541586.0,2867598073.0,3131909698.0,3228439312.0,4193793485.0,5819901466.0,8263276820.0
4,Phân bổ lợi thế thương mại,-8050388499.0,0.0,0.0,0.0,0.0,0.0,0.0,0.0,0.0,0.0
5,Chi phí dự phòng,0.0,-82318592.0,253122938.0,-234251124.0,-754236689.0,150312482.0,26305500.0,42235285.0,117469765.0,2430548828.0
6,Lãi/(lỗ) chênh lệch tỷ giá chưa thực hiện,0.0,0.0,0.0,0.0,0.0,-429828.0,0.0,0.0,1304262142.0,3674360273.0
7,Lãi/(lỗ) từ thanh lý tài sản cố định,0.0,0.0,0.0,0.0,0.0,0.0,0.0,0.0,0.0,0.0
8,Lãi/(lỗ) từ hoạt động đầu tư,7439466869.0,0.0,-505467894.0,-1134965933.0,-2912009621.0,-1024031085.0,-1320631674.0,-352252953.0,-1193196145.0,-13282570506.0
9,Chi phí lãi vay,9111257061.0,9534043948.0,4406350520.0,338362266.0,730986564.0,0.0,59863014.0,275616437.0,1307260841.0,10988751050.0
10,Thu lãi và cổ tức,0.0,0.0,0.0,0.0,0.0,0.0,0.0,0.0,0.0,0.0
11,Các khoản điều chỉnh khác,0.0,0.0,0.0,0.0,0.0,0.0,0.0,0.0,0.0,0.0
12,(Tăng)/giảm các khoản phải thu,-5738847565.0,4742036607.0,-5121049895.0,209238150.0,-130263883.0,-2039170010.0,-5123261263.0,-7562164538.0,1687611706.0,-7477429826.0
13,(Tăng)/giảm hàng tồn kho,7710018271.0,-796389362.0,209988257.0,-1717029706.0,-3430149833.0,-7873835066.0,-1871065552.0,494367839.0,-12546038696.0,1871648539.0
14,Tăng/(giảm) các khoản phải trả,8528277983.0,-4205831242.0,5370676048.0,3565084419.0,-11467735995.0,-6507608182.0,4201337666.0,-1845834494.0,-840830320.0,-2802007517.0
15,( Tăng)/giảm chi phí trả trước,-698737005.0,-55614837.0,-247683852.0,807158380.0,-9071045.0,599525704.0,385089305.0,-1834692408.0,-1936034521.0,1198413863.0
16,(Tăng)/giảm chứng khoán kinh doanh,0.0,0.0,0.0,0.0,0.0,0.0,1289226708.0,-5859164001.0,-14174210420.0,9537185833.0
17,Chi phí lãi vay đã trả,-9111257061.0,0.0,-182112644.0,-57400000.0,-961604560.0,-9200000000.0,-24613578417.0,-3324906186.0,-139690823.0,-8415820252.0
18,Thuế thu nhập doanh nghiệp đã trả,0.0,0.0,0.0,0.0,0.0,-1156011543.0,-2811317321.0,-5145969528.0,-2537688442.0,-2400000000.0
19,Tiền thu khác từ các hoạt động kinh doanh,0.0,0.0,0.0,0.0,0.0,0.0,0.0,0.0,0.0,0.0
20,Tiền chi khác từ các hoạt động kinh doanh,-114954473.0,33923431.0,-510100283.0,-280744000.0,-682000000.0,0.0,0.0,0.0,-519863518.0,0.0
21,Lưu chuyển tiền tệ ròng từ hoạt động đầu tư,-2045859715.0,-4944669091.0,-11446498606.0,-14677732226.0,4039087397.0,9591087782.0,6087866118.0,-17359289770.0,-113212749149.0,-50819963546.0
22,Tiền mua tài sản cố định và các tài sản dài hạn khác,-2853286932.0,-694669091.0,-2165966500.0,-12652489165.0,-3345809678.0,-1310066201.0,-10488359935.0,-23358573567.0,-18572887758.0,-20284707264.0
23,Tiền thu được từ thanh lý tài sản cố định,4363636364.0,0.0,436363637.0,104545454.0,0.0,0.0,310000000.0,210000000.0,89090909.0,898030855.0
24,Tiền cho vay hoặc mua công cụ nợ,-4000000000.0,-4250000000.0,-10891000000.0,-20755000000.0,-40845000000.0,-45900000000.0,-26000000000.0,-10000000000.0,-155000000000.0,-267360986301.0
25,Tiền thu từ cho vay hoặc thu từ phát hành công cụ nợ,0.0,0.0,1105000000.0,17641000000.0,36550000000.0,55645000000.0,41200000000.0,15000000000.0,60000000000.0,224000000000.0
26,Đầu tư vào các doanh nghiệp khác,0.0,0.0,0.0,0.0,0.0,0.0,0.0,0.0,0.0,0.0
27,Tiền thu từ việc bán các khoản đầu tư vào các doanh nghiệp khác,0.0,0.0,0.0,0.0,10600000000.0,0.0,0.0,0.0,0.0,0.0
28,Cổ tức và tiền lãi nhận được,443790853.0,0.0,69104257.0,984211485.0,1079897075.0,1156153983.0,1066226053.0,789283797.0,271047700.0,11927699164.0
29,Lưu chuyển tiền tệ từ hoạt động tài chính,-5678543643.0,-11787952322.0,-9370660874.0,-5641789591.0,0.0,0.0,4700779288.0,48760000000.0,143459523179.0,13371137.0
30,Tiền thu từ phát hành cổ phiếu và vốn góp,0.0,0.0,0.0,0.0,0.0,0.0,0.0,54760000000.0,0.0,0.0
31,"Chi trả cho việc mua lại, trả lại cổ phiếu",0.0,0.0,0.0,0.0,0.0,0.0,0.0,0.0,0.0,0.0
32,Tiền thu được các khoản đi vay,800000000.0,0.0,0.0,0.0,0.0,0.0,22700779288.0,6000000000.0,143459523179.0,51402090599.0
33,Tiển trả các khoản đi vay,-6478543643.0,-11787952322.0,-8290660874.0,-4232441591.0,0.0,0.0,-18000000000.0,-12000000000.0,0.0,-51388719462.0
34,Tiền thanh toán vốn gốc đi thuê tài chính,0.0,0.0,0.0,0.0,0.0,0.0,0.0,0.0,0.0,0.0
35,Cổ tức đã trả,0.0,0.0,-1080000000.0,-1409348000.0,0.0,0.0,0.0,0.0,0.0,0.0
36,Tiền lãi đã nhận,0.0,0.0,0.0,0.0,0.0,0.0,0.0,0.0,0.0,0.0
37,Lưu chuyển tiền thuần trong kỳ,-172296163.0,289941510.0,-1311638952.0,73085549.0,2690809153.0,-1553200478.0,6082559396.0,39424884705.0,14330110786.0,-45600345130.0
38,Tiền và tương đương tiền đầu kỳ,2045530233.0,1873234070.0,2163175580.0,851536628.0,924622177.0,3615431330.0,2062660680.0,8145220076.0,47570104781.0,61495953425.0
39,Ảnh hưởng của chênh lệch tỷ giá,0.0,0.0,0.0,0.0,0.0,429828.0,0.0,0.0,-404262142.0,639727.0
40,Tiền và tương đương tiền cuối kỳ,1873234070.0,2163175580.0,851536628.0,924622177.0,3615431330.0,2062660680.0,8145220076.0,47570104781.0,61495953425.0,15896248022.0
