,Unnamed: 0,2013,2014,2015,2016,2017,2018,2019,2020,2021,2022
0,Lưu chuyển tiền thuần từ các hoạt động sản xuất kinh doanh,-15452487975.0,56646008917.0,69703705373.0,50213787510.0,-54031490736.0,-31164404411.0,72980749138.0,71187426921.0,16932132055.0,-23741464236.0
1,Lãi/lỗ trước những thay đổi vốn lưu động,46048844450.0,27906028753.0,23181110827.0,32507728697.0,38008113333.0,43722721275.0,40244461762.0,42829740855.0,34785286739.0,33804053367.0
2,Lãi trước thuế,27997886717.0,13240508748.0,13420547120.0,26445339375.0,36905599440.0,37922673701.0,25975374343.0,27541881947.0,19222746297.0,18993203938.0
3,Khấu hao TSCĐ,8587620218.0,9397049147.0,9780514760.0,10727925457.0,9184326577.0,9872972695.0,11682565190.0,18468886651.0,20112944210.0,19702474588.0
5,Chi phí dự phòng,2899314135.0,-8035289558.0,0.0,667310313.0,-1214891550.0,-2040490157.0,-807627696.0,0.0,0.0,-1294268140.0
6,Lãi/(lỗ) chênh lệch tỷ giá chưa thực hiện,1702053214.0,1420952317.0,503026831.0,801743481.0,171830217.0,-1831827066.0,2411776.0,-735076798.0,-654866575.0,-2424841277.0
8,Lãi/(lỗ) từ hoạt động đầu tư,-6476483143.0,995792315.0,-7560757436.0,-9856624179.0,-12133612087.0,-7528972358.0,-4942858779.0,-9836380082.0,-10025597174.0,-9305844533.0
9,Chi phí lãi vay,11338453309.0,10887015784.0,6554394895.0,3722034250.0,5094860736.0,7328364460.0,8334596928.0,7390429137.0,6130059981.0,8133328791.0
11,Các khoản điều chỉnh khác,0.0,0.0,0.0,0.0,0.0,0.0,0.0,0.0,0.0,0.0
12,(Tăng)/giảm các khoản phải thu,-130633058762.0,31844034005.0,59938071841.0,-2473251288.0,-75450436929.0,-59233596618.0,38833878443.0,14495330403.0,-73745252641.0,22761871502.0
13,(Tăng)/giảm hàng tồn kho,-23709390098.0,-1714542310.0,55332871710.0,35449545643.0,-60043737998.0,-59821554056.0,-12429898370.0,34493916055.0,-80566771775.0,14639513305.0
14,Tăng/(giảm) các khoản phải trả,109061031857.0,124562328667.0,-65975446945.0,-13396407495.0,47512590414.0,52757537873.0,20100443464.0,-5971738952.0,144875111918.0,-85729645945.0
15,( Tăng)/giảm chi phí trả trước,-814418031.0,-111783368425.0,5954201699.0,6281268606.0,5650141289.0,3390541735.0,2386181420.0,-3678979795.0,3533868828.0,3110918569.0
16,(Tăng)/giảm chứng khoán kinh doanh,0.0,0.0,0.0,0.0,0.0,0.0,0.0,0.0,0.0,0.0
17,Chi phí lãi vay đã trả,-10745729926.0,-10922591684.0,-6873226476.0,-3765184152.0,-4963551338.0,-7280054620.0,-8291782166.0,-7576029137.0,-6127059981.0,-8056428791.0
18,Thuế thu nhập doanh nghiệp đã trả,-4659767465.0,-3245880089.0,-1853877283.0,-4389912501.0,-4744609507.0,-4700000000.0,-7862535415.0,-3404812508.0,-5823051033.0,-4271746243.0
19,Tiền thu khác từ các hoạt động kinh doanh,0.0,0.0,0.0,0.0,0.0,0.0,0.0,0.0,0.0,0.0
20,Tiền chi khác từ các hoạt động kinh doanh,0.0,0.0,0.0,0.0,0.0,0.0,0.0,0.0,0.0,0.0
21,Lưu chuyển tiền tệ ròng từ hoạt động đầu tư,-100227001061.0,26159399061.0,48041854023.0,-121553085408.0,21563340962.0,90966429331.0,-37625915321.0,-86224410811.0,-2888176226.0,38241774818.0
22,Tiền mua tài sản cố định và các tài sản dài hạn khác,-6786585000.0,-7997343503.0,-403355910.0,-12229805650.0,-25429931063.0,-19645015666.0,-20136643773.0,-30996212263.0,-10818126136.0,-5606748220.0
23,Tiền thu được từ thanh lý tài sản cố định,322000000.0,941270000.0,1320000000.0,1595000000.0,590000000.0,120000000.0,96500000.0,0.0,0.0,854200000.0
24,Tiền cho vay hoặc mua công cụ nợ,-303800000000.0,-172400000000.0,-165327777778.0,-276001396605.0,-185523691389.0,-23500000000.0,-58000000000.0,-81200000000.0,-70186250548.0,-39000000000.0
25,Tiền thu từ cho vay hoặc thu từ phát hành công cụ nợ,204300000000.0,193700000000.0,201400000000.0,157385174383.0,220744000000.0,121023691389.0,23000000000.0,18000000000.0,68200000000.0,72000000000.0
26,Đầu tư vào các doanh nghiệp khác,-2100000000.0,0.0,0.0,0.0,0.0,0.0,0.0,0.0,0.0,0.0
27,Tiền thu từ việc bán các khoản đầu tư vào các doanh nghiệp khác,0.0,2712259721.0,4700000000.0,3000000000.0,0.0,3472500000.0,11967396000.0,0.0,0.0,0.0
28,Cổ tức và tiền lãi nhận được,7837583939.0,9203212843.0,6352987711.0,4697942464.0,11182963414.0,9495253608.0,5446832452.0,7971801452.0,9916200458.0,9994323038.0
29,Lưu chuyển tiền tệ từ hoạt động tài chính,25112545043.0,-26615575314.0,-112651911590.0,43757445906.0,-4718022079.0,-36104152495.0,-31920366206.0,12384745671.0,-25151985300.0,-33968795678.0
30,Tiền thu từ phát hành cổ phiếu và vốn góp,0.0,0.0,0.0,0.0,0.0,0.0,12480000000.0,0.0,0.0,0.0
31,"Chi trả cho việc mua lại, trả lại cổ phiếu",0.0,0.0,0.0,0.0,0.0,0.0,0.0,0.0,0.0,0.0
32,Tiền thu được các khoản đi vay,328177483160.0,354090295415.0,311057582356.0,407604496888.0,453457455834.0,471438593954.0,484676673115.0,493430989796.0,552101661210.0,585111509807.0
33,Tiển trả các khoản đi vay,-273288399717.0,-360043770729.0,-413400757946.0,-349963108582.0,-443461689113.0,-475709878449.0,-503640202520.0,-463035000925.0,-559260274910.0,-603361467485.0
34,Tiền thanh toán vốn gốc đi thuê tài chính,0.0,0.0,0.0,0.0,0.0,0.0,0.0,0.0,0.0,0.0
35,Cổ tức đã trả,-29776538400.0,-20662100000.0,-10308736000.0,-13883942400.0,-14713788800.0,-31832868000.0,-25436836801.0,-18011243200.0,-17993371600.0,-15718838000.0
37,Lưu chuyển tiền thuần trong kỳ,-90566943993.0,56189832664.0,5093647806.0,-27581851992.0,-37186171853.0,23697872425.0,3434467611.0,-2652238219.0,-11108029471.0,-19468485096.0
38,Tiền và tương đương tiền đầu kỳ,111581303792.0,21014250213.0,77305028820.0,82364036940.0,54995857156.0,17862092511.0,41430643779.0,44892001815.0,42201969062.0,30978993605.0
39,Ảnh hưởng của chênh lệch tỷ giá,-109586.0,100945943.0,-34639686.0,213672208.0,52407208.0,-129321157.0,26890425.0,-37794534.0,-114945986.0,143110858.0
40,Tiền và tương đương tiền cuối kỳ,21014250213.0,77305028820.0,82364036940.0,54995857156.0,17862092511.0,41430643779.0,44892001815.0,42201969062.0,30978993605.0,11653619367.0
