,Unnamed: 0,2013,2014,2015,2016,2017,2018,2019,2020,2021,2022
0,Lưu chuyển tiền thuần từ các hoạt động sản xuất kinh doanh,43242313014.0,46320870347.0,71462189021.0,76201748797.0,46914765923.0,46629645875.0,69080526554.0,71593742442.0,34347820262.0,1011490390.0
1,Lãi/lỗ trước những thay đổi vốn lưu động,54080226187.0,65446561658.0,76951325558.0,89949629727.0,95805394373.0,105610971463.0,84452392921.0,90667090830.0,70100259363.0,84871718416.0
2,Lãi trước thuế,51708394703.0,67099418826.0,80457055166.0,115666560852.0,125325283599.0,112369126071.0,92749150912.0,100085227040.0,76340558222.0,86956913128.0
3,Khấu hao TSCĐ,5701863486.0,4448953973.0,5110234338.0,6123889515.0,4788056384.0,4465061765.0,4693481225.0,4824500047.0,6390699503.0,7694331907.0
5,Chi phí dự phòng,1481302501.0,-243293501.0,-2174194141.0,-63814859.0,0.0,206695166.0,237936167.0,-120437167.0,-136014500.0,-331200833.0
6,Lãi/(lỗ) chênh lệch tỷ giá chưa thực hiện,-178712130.0,164830897.0,31813921.0,415171378.0,11805328.0,143602540.0,-47148173.0,-30546175.0,-84165350.0,155235234.0
8,Lãi/(lỗ) từ hoạt động đầu tư,-5734219479.0,-6912929949.0,-6983831586.0,-32607897801.0,-34703150168.0,-11780480671.0,-13813574412.0,-14855912443.0,-13361554462.0,-11350012359.0
9,Chi phí lãi vay,1101597106.0,889581412.0,510247860.0,415720642.0,383399230.0,206966592.0,632547202.0,764259528.0,950735950.0,1746451339.0
11,Các khoản điều chỉnh khác,0.0,0.0,0.0,0.0,0.0,0.0,0.0,0.0,0.0,0.0
12,(Tăng)/giảm các khoản phải thu,-957846188.0,1277806007.0,-38103756.0,3549939988.0,12603206838.0,-8231544979.0,17131899442.0,-24554204195.0,20902033587.0,-89844630309.0
13,(Tăng)/giảm hàng tồn kho,-1541733647.0,-1128681334.0,7761369641.0,4547689314.0,-3646349121.0,-18275860322.0,-7358833771.0,13680630551.0,-23077423531.0,-2662031217.0
14,Tăng/(giảm) các khoản phải trả,6110521662.0,2108213282.0,6335072803.0,-4482329575.0,-43434585507.0,-7891948730.0,-1205896425.0,14807140527.0,-7690636836.0,23616156537.0
15,( Tăng)/giảm chi phí trả trước,1457195904.0,1317470763.0,1004301257.0,9971374600.0,11928892144.0,66602457.0,-2067480447.0,828582714.0,-3710266058.0,187081493.0
16,(Tăng)/giảm chứng khoán kinh doanh,0.0,0.0,0.0,0.0,0.0,0.0,0.0,0.0,0.0,0.0
17,Chi phí lãi vay đã trả,-1115009459.0,-889581412.0,-510247860.0,-415720642.0,-383399230.0,-206966592.0,-632547202.0,-764259528.0,-950735950.0,-1746451339.0
18,Thuế thu nhập doanh nghiệp đã trả,-10390440445.0,-20758498467.0,-20041528622.0,-18470430853.0,-23990341439.0,-22570287482.0,-18813925114.0,-18615326057.0,-18034220113.0,-11629862065.0
19,Tiền thu khác từ các hoạt động kinh doanh,116719000.0,0.0,0.0,0.0,0.0,0.0,0.0,0.0,0.0,0.0
20,Tiền chi khác từ các hoạt động kinh doanh,-4517320000.0,-1052420150.0,0.0,-8448403762.0,-1968052135.0,-1871319940.0,-2425082850.0,-4455912400.0,-3191190200.0,-1780491126.0
21,Lưu chuyển tiền tệ ròng từ hoạt động đầu tư,-39586190894.0,-45105147952.0,18207071752.0,-36592384289.0,32102357220.0,56494772005.0,-50162473733.0,3490884439.0,38280038704.0,80523189369.0
22,Tiền mua tài sản cố định và các tài sản dài hạn khác,-2410193573.0,-8667055531.0,-4199194113.0,-4463990982.0,-1286573100.0,-5506008568.0,-3428176507.0,-57906496231.0,-5036457900.0,-17259781248.0
23,Tiền thu được từ thanh lý tài sản cố định,1304053046.0,188363851.0,1708181819.0,37689170000.0,33946500000.0,104545455.0,185454545.0,0.0,0.0,45454545.0
24,Tiền cho vay hoặc mua công cụ nợ,-43100000000.0,-43100000000.0,0.0,-368800000000.0,-328400000000.0,-349600000000.0,-337063528219.0,-292400000000.0,-222100079076.0,-213300109674.0
25,Tiền thu từ cho vay hoặc thu từ phát hành công cụ nợ,0.0,0.0,13600000000.0,292200000000.0,319400000000.0,398000000000.0,277700000000.0,337963528219.0,250700000000.0,299600188750.0
26,Đầu tư vào các doanh nghiệp khác,0.0,0.0,0.0,0.0,0.0,0.0,0.0,0.0,0.0,0.0
27,Tiền thu từ việc bán các khoản đầu tư vào các doanh nghiệp khác,0.0,0.0,0.0,0.0,0.0,0.0,0.0,0.0,0.0,0.0
28,Cổ tức và tiền lãi nhận được,4619949633.0,6473543728.0,7098084046.0,6782436693.0,8442430320.0,13496235118.0,12443776448.0,15833852451.0,14716575680.0,11437436996.0
29,Lưu chuyển tiền tệ từ hoạt động tài chính,-35189972457.0,-1864698797.0,-88677455984.0,-39877091059.0,-82305214760.0,-86936748400.0,-27228189250.0,-83035370800.0,-65235876500.0,-70404585000.0
30,Tiền thu từ phát hành cổ phiếu và vốn góp,0.0,0.0,5186180000.0,9690443636.0,0.0,7427920000.0,0.0,0.0,8418900000.0,0.0
31,"Chi trả cho việc mua lại, trả lại cổ phiếu",0.0,0.0,0.0,0.0,0.0,-465750000.0,-1073250000.0,-768500000.0,-503250000.0,-720000000.0
32,Tiền thu được các khoản đi vay,99181288283.0,128383741363.0,99753701847.0,79782692941.0,72090210230.0,61537784000.0,86630914500.0,79237195000.0,87909090000.0,111888323000.0
33,Tiển trả các khoản đi vay,-115705462340.0,-112626175560.0,-145171516231.0,-66436219461.0,-57720706490.0,-69614695850.0,0.0,-76957094000.0,-89975829500.0,-142844831000.0
34,Tiền thanh toán vốn gốc đi thuê tài chính,0.0,0.0,0.0,0.0,0.0,0.0,-53794412600.0,0.0,0.0,0.0
35,Cổ tức đã trả,-18665798400.0,-17622264600.0,-48445821600.0,-62914008175.0,-96674718500.0,-85822006550.0,-58991441150.0,-84546971800.0,-71084787000.0,-38728077000.0
37,Lưu chuyển tiền thuần trong kỳ,-31533850337.0,-648976402.0,991804789.0,-267726551.0,-3288091617.0,16187669480.0,-8310136429.0,-7950743919.0,7391982466.0,11130094759.0
38,Tiền và tương đương tiền đầu kỳ,34976093331.0,3499241715.0,2917656003.0,4246976830.0,3982769603.0,742782268.0,16949327615.0,8685927841.0,896972677.0,8499528295.0
39,Ảnh hưởng của chênh lệch tỷ giá,56998721.0,67390690.0,337516038.0,3519324.0,48104282.0,18875867.0,46736655.0,161788755.0,210573152.0,-118725193.0
40,Tiền và tương đương tiền cuối kỳ,3499241715.0,2917656003.0,4246976830.0,3982769603.0,742782268.0,16949327615.0,8685927841.0,896972677.0,8499528295.0,19510897861.0
