,Unnamed: 0,Q3 2020,Q4 2020,Q1 2021,Q2 2021,Q3 2021,Q4 2021,Q1 2022,Q2 2022,Q3 2022,Q4 2022
0,Lưu chuyển tiền thuần từ các hoạt động sản xuất kinh doanh,278010848068.0,213098968850.0,97707617871.0,44813238449.0,-24681964381.0,120442418229.0,-65465560244.0,265305489807.0,127602970532.0,-38268438242.0
1,Lãi/lỗ trước những thay đổi vốn lưu động,174141446831.0,138709145535.0,123101734419.0,129366820742.0,11529796238.0,151258783291.0,144611310511.0,248834678653.0,147200446832.0,24651995647.0
2,Lãi trước thuế,161630759680.0,118526831606.0,107385892958.0,114774917305.0,6080989167.0,130323084596.0,144764608890.0,233412894581.0,132753139284.0,-4263994553.0
3,Khấu hao TSCĐ,19785176610.0,20395416222.0,20852711665.0,20615435393.0,20943263880.0,21508018319.0,20686827038.0,21509101724.0,19988741054.0,20300964195.0
4,Phân bổ lợi thế thương mại,0.0,0.0,0.0,0.0,0.0,0.0,0.0,0.0,0.0,0.0
5,Chi phí dự phòng,-4984984503.0,3473781438.0,-325713028.0,-1347942993.0,-11681141543.0,3293816827.0,-16454365035.0,-988681867.0,-3986397770.0,6390601912.0
6,Lãi/(lỗ) chênh lệch tỷ giá chưa thực hiện,-592298468.0,284619586.0,0.0,-24779157.0,24779157.0,-318054357.0,0.0,-2891929634.0,2891929634.0,6966897124.0
8,Lãi/(lỗ) từ hoạt động đầu tư,-4642772878.0,-5803554959.0,-6559770657.0,-6505702485.0,-5659075028.0,-5143573677.0,-5970138756.0,-4622954908.0,-6730774965.0,-7339753165.0
9,Chi phí lãi vay,2945566390.0,1832051642.0,1748613481.0,1854892679.0,1820980605.0,1595491583.0,1584378374.0,2416248757.0,2283809595.0,2597280134.0
11,Các khoản điều chỉnh khác,0.0,0.0,0.0,0.0,0.0,0.0,0.0,0.0,0.0,0.0
12,(Tăng)/giảm các khoản phải thu,97307015857.0,32977838612.0,-16005954383.0,-17529769956.0,27215140003.0,31270070254.0,-88652295703.0,-114241960857.0,123084389232.0,52907076589.0
13,(Tăng)/giảm hàng tồn kho,26426543808.0,124933185322.0,11961726314.0,-94383660662.0,-24986620062.0,-34878139554.0,-48256319403.0,28664010815.0,-98041965831.0,-108881460260.0
14,Tăng/(giảm) các khoản phải trả,2533287259.0,-34143880604.0,9450898808.0,45147190426.0,-10788713977.0,-11487055809.0,-31166512001.0,115800024866.0,-1387211970.0,59897863052.0
15,( Tăng)/giảm chi phí trả trước,-5190131832.0,-2858570544.0,2874465889.0,331047007.0,11009222076.0,3268238782.0,7526511024.0,-1977213727.0,4078611824.0,-7912607003.0
16,(Tăng)/giảm chứng khoán kinh doanh,0.0,0.0,0.0,0.0,0.0,0.0,0.0,0.0,0.0,0.0
17,Chi phí lãi vay đã trả,-2932575646.0,-2033962796.0,-1647572695.0,-1895494639.0,-1941802879.0,-1458644980.0,-1639628954.0,-2137439636.0,-2469900700.0,-2557684190.0
18,Thuế thu nhập doanh nghiệp đã trả,-7749628054.0,-44187287785.0,-4779110006.0,-15848734393.0,-24866039780.0,-17205618706.0,-13574361118.0,-14785193016.0,-39831817614.0,-55547501141.0
19,Tiền thu khác từ các hoạt động kinh doanh,0.0,0.0,0.0,0.0,0.0,0.0,0.0,0.0,0.0,0.0
20,Tiền chi khác từ các hoạt động kinh doanh,-6525110155.0,-297498890.0,-27248570475.0,-374160076.0,-11852946000.0,-325215049.0,-34314264600.0,5148582709.0,-5029581241.0,-826120936.0
21,Lưu chuyển tiền tệ ròng từ hoạt động đầu tư,-107868433910.0,-120144819688.0,71525421074.0,-13197253890.0,73559205733.0,-49641945805.0,48985873807.0,-161768407017.0,-233161991544.0,54909140852.0
22,Tiền mua tài sản cố định và các tài sản dài hạn khác,-22014996512.0,-26139075232.0,-8955480371.0,-17434502529.0,-13390586672.0,-30374448992.0,-19146633629.0,-34923448648.0,-45072391235.0,-70461453381.0
23,Tiền thu được từ thanh lý tài sản cố định,510596277.0,274636367.0,299545455.0,1614191461.0,83179293.0,169693440.0,7254546.0,1514522938.0,83790550.0,131265784.0
24,Tiền cho vay hoặc mua công cụ nợ,-169000000000.0,-122000000000.0,-181000000000.0,-156499139200.0,-40400000000.0,-143100000000.0,-7162323288.0,-274300000000.0,-199500000000.0,-135770000000.0
25,Tiền thu từ cho vay hoặc thu từ phát hành công cụ nợ,78500000000.0,26000000000.0,250000000000.0,153500000000.0,127500000000.0,117000000000.0,71000000000.0,139999139200.0,9062323288.0,277000000000.0
26,Đầu tư vào các doanh nghiệp khác,0.0,0.0,0.0,0.0,-7000000000.0,0.0,0.0,0.0,0.0,-25000000000.0
27,Tiền thu từ việc bán các khoản đầu tư vào các doanh nghiệp khác,0.0,0.0,0.0,0.0,0.0,0.0,0.0,0.0,0.0,0.0
28,Cổ tức và tiền lãi nhận được,4135966325.0,1719619177.0,11181355990.0,5622196378.0,6766613112.0,6662809747.0,4287576178.0,5941379493.0,2264285853.0,9009328449.0
29,Lưu chuyển tiền tệ từ hoạt động tài chính,-97279928512.0,-27093755800.0,-44834026888.0,12888789667.0,-181270885599.0,24665554353.0,-56053900789.0,-51231694235.0,-40748392380.0,55607948185.0
30,Tiền thu từ phát hành cổ phiếu và vốn góp,0.0,15000000000.0,0.0,0.0,0.0,0.0,0.0,0.0,477556954.0,1178623046.0
31,"Chi trả cho việc mua lại, trả lại cổ phiếu",0.0,0.0,0.0,0.0,0.0,0.0,0.0,0.0,0.0,0.0
32,Tiền thu được các khoản đi vay,177505088264.0,155576425150.0,159926467109.0,182295910004.0,99809801906.0,141239235486.0,90423036046.0,215512068965.0,233497412883.0,241084961671.0
33,Tiển trả các khoản đi vay,-160343337276.0,-197670180950.0,-126966040997.0,-169407120337.0,-164442346880.0,-116550603258.0,-107549449335.0,-150052083700.0,-274723362217.0,-186655636532.0
34,Tiền thanh toán vốn gốc đi thuê tài chính,0.0,0.0,0.0,0.0,0.0,0.0,0.0,0.0,0.0,0.0
35,Cổ tức đã trả,-114441679500.0,0.0,-77794453000.0,0.0,-116638340625.0,-23077875.0,-38927487500.0,-116691679500.0,0.0,0.0
37,Lưu chuyển tiền thuần trong kỳ,72862485646.0,65860393362.0,124399012057.0,44504774226.0,-132393644247.0,95466026777.0,-72533587226.0,52305388555.0,-146307413392.0,72248650795.0
38,Tiền và tương đương tiền đầu kỳ,232619036934.0,305713333640.0,371680211939.0,495936897117.0,540363905992.0,407909613996.0,503425694773.0,430991414937.0,483978904193.0,336679571450.0
39,Ảnh hưởng của chênh lệch tỷ giá,231811060.0,106484937.0,-142326879.0,-77765351.0,-60647749.0,50054000.0,99307390.0,682100701.0,-991919351.0,-3560096621.0
40,Tiền và tương đương tiền cuối kỳ,305713333640.0,371680211939.0,495936897117.0,540363905992.0,407909613996.0,503425694773.0,430991414937.0,483978904193.0,336679571450.0,405368125624.0
