,Unnamed: 0,Q3 2020,Q4 2020,Q1 2021,Q2 2021,Q3 2021,Q4 2021,Q1 2022,Q2 2022,Q3 2022,Q4 2022
0,Lưu chuyển tiền thuần từ các hoạt động sản xuất kinh doanh,391889989768.0,728269280341.0,524511936472.0,-781371219613.0,-349783813722.0,-110551689256.0,1706777416232.0,202221567070.0,-637630286316.0,-1177603589418.0
1,Lãi/lỗ trước những thay đổi vốn lưu động,313794085362.0,586028473406.0,689580245753.0,306653734983.0,-149954191810.0,593947042564.0,958642578534.0,515549516662.0,367176539422.0,602872095237.0
2,Lãi trước thuế,256095727112.0,535493073309.0,648288049259.0,273211431261.0,-193509376194.0,559359481372.0,913285975874.0,476997372679.0,329630611085.0,591324894516.0
3,Khấu hao TSCĐ,17686378973.0,17181902195.0,17048142941.0,20261046221.0,13817993630.0,23856784724.0,19339804278.0,20508564871.0,19218561074.0,18584993552.0
4,Phân bổ lợi thế thương mại,0.0,0.0,0.0,0.0,0.0,0.0,0.0,0.0,0.0,0.0
5,Chi phí dự phòng,0.0,1202878846.0,0.0,0.0,0.0,0.0,0.0,6961458640.0,-6961458640.0,-17681266091.0
6,Lãi/(lỗ) chênh lệch tỷ giá chưa thực hiện,137173996.0,-517242077.0,112923305.0,-3375982850.0,-897857647.0,6467605453.0,-4532479750.0,737642756.0,9638482208.0,-3017098982.0
8,Lãi/(lỗ) từ hoạt động đầu tư,-805342186.0,3561992916.0,1360877290.0,-4477719085.0,2899335567.0,-28576177917.0,-321375125.0,-2603140939.0,-1569159410.0,-19445084149.0
9,Chi phí lãi vay,40680147467.0,29105868217.0,22770252958.0,21034959436.0,27735712834.0,32839348932.0,30870653257.0,12947618655.0,17219503105.0,33105656391.0
11,Các khoản điều chỉnh khác,0.0,0.0,0.0,0.0,0.0,0.0,0.0,0.0,0.0,0.0
12,(Tăng)/giảm các khoản phải thu,-22371311040.0,48470685035.0,-21628576121.0,10599370773.0,-24553556783.0,19705996307.0,-18838079147.0,-7873556933.0,-79745831868.0,-76719219381.0
13,(Tăng)/giảm hàng tồn kho,104094069196.0,-218890253588.0,125170956253.0,-1030383425603.0,-58828940128.0,-1176651519623.0,1306297367929.0,-510894374819.0,-1327568401469.0,-1219078282385.0
14,Tăng/(giảm) các khoản phải trả,70725484727.0,469767250473.0,-109999766827.0,28457040613.0,-138275917987.0,570469365365.0,-319959835091.0,354765469799.0,472291240036.0,-288191880166.0
15,( Tăng)/giảm chi phí trả trước,-15912558472.0,-26725903397.0,20107457420.0,11119003024.0,29369868802.0,-55926864802.0,1174506906.0,-8316266585.0,-5780378609.0,-59973205631.0
16,(Tăng)/giảm chứng khoán kinh doanh,0.0,0.0,0.0,0.0,0.0,0.0,0.0,0.0,0.0,0.0
17,Chi phí lãi vay đã trả,-43055957149.0,-29777236151.0,-23062361473.0,-20753216897.0,-27879025338.0,-34219651495.0,-31384674043.0,-14029461621.0,-15563959777.0,-30192825968.0
18,Thuế thu nhập doanh nghiệp đã trả,-14644029298.0,-97777225395.0,-155352481872.0,-57470080836.0,-11673184415.0,-9865975682.0,-187321373205.0,-80889646933.0,-80022716868.0,-110222391758.0
19,Tiền thu khác từ các hoạt động kinh doanh,0.0,0.0,0.0,-29897182331.0,32011133937.0,-2113951606.0,0.0,0.0,0.0,0.0
20,Tiền chi khác từ các hoạt động kinh doanh,-739793558.0,-2826510042.0,-303536661.0,303536661.0,0.0,-15896130284.0,-1833075651.0,-46090112500.0,31583222817.0,3902120634.0
21,Lưu chuyển tiền tệ ròng từ hoạt động đầu tư,-8647949044.0,-23607589349.0,-4248548612.0,-18965549064.0,-1010597459.0,-24732070284.0,-3268027554.0,-242448167807.0,-256981013095.0,138657852482.0
22,Tiền mua tài sản cố định và các tài sản dài hạn khác,-9477288179.0,-22394677255.0,-4594021616.0,-31605792707.0,-1654552939.0,-25510764772.0,-3654232828.0,-15415366035.0,-12381332113.0,-18025370406.0
23,Tiền thu được từ thanh lý tài sản cố định,5498540.0,0.0,288277783.0,12522635737.0,-149910530.0,93960342.0,64830149.0,319291200.0,179657021.0,934407415.0
24,Tiền cho vay hoặc mua công cụ nợ,0.0,0.0,0.0,0.0,0.0,0.0,0.0,-230000000000.0,-247000000000.0,-63000000000.0
25,Tiền thu từ cho vay hoặc thu từ phát hành công cụ nợ,0.0,0.0,0.0,0.0,0.0,0.0,0.0,0.0,0.0,200000000000.0
26,Đầu tư vào các doanh nghiệp khác,0.0,0.0,0.0,0.0,0.0,0.0,0.0,0.0,0.0,0.0
27,Tiền thu từ việc bán các khoản đầu tư vào các doanh nghiệp khác,0.0,0.0,0.0,0.0,0.0,0.0,0.0,0.0,0.0,0.0
28,Cổ tức và tiền lãi nhận được,823840595.0,-1212912094.0,57195221.0,117607906.0,793866010.0,684734146.0,321375125.0,2647907028.0,2220661997.0,18748815473.0
29,Lưu chuyển tiền tệ từ hoạt động tài chính,-380946612952.0,-514709541333.0,-729109793942.0,836760553607.0,293149787764.0,300787127605.0,391632022432.0,-1101647743685.0,761105798556.0,740620468985.0
30,Tiền thu từ phát hành cổ phiếu và vốn góp,0.0,46375540000.0,-1524800000.0,1524800000.0,0.0,0.0,1410946550000.0,0.0,36319980000.0,0.0
31,"Chi trả cho việc mua lại, trả lại cổ phiếu",0.0,0.0,0.0,-1524800000.0,0.0,0.0,0.0,0.0,0.0,0.0
32,Tiền thu được các khoản đi vay,617933471322.0,1919791109500.0,1778807220969.0,1673333692872.0,1503094694900.0,2800967073457.0,2387744838452.0,498000501164.0,1683968350509.0,1749625759721.0
33,Tiển trả các khoản đi vay,-1004846313477.0,-2341021081260.0,-2506156421511.0,-659482548340.0,-1209944195016.0,-2500179945852.0,-3278195195170.0,-1452121258089.0,-815634070593.0,-812273751366.0
34,Tiền thanh toán vốn gốc đi thuê tài chính,0.0,0.0,0.0,0.0,0.0,0.0,0.0,0.0,0.0,0.0
35,Cổ tức đã trả,5966229203.0,-139855109573.0,-235793400.0,-177090590925.0,-712120.0,0.0,-128864170850.0,-147526986760.0,-143548461360.0,-196731539370.0
37,Lưu chuyển tiền thuần trong kỳ,2295427772.0,189952149659.0,-208846406082.0,36423784930.0,-57644623417.0,165503368065.0,2095141411110.0,-1141874344422.0,-133505500855.0,-298325267951.0
38,Tiền và tương đương tiền đầu kỳ,229987203630.0,232282631402.0,422234781061.0,213388374979.0,249812159909.0,192167536492.0,355454838957.0,2450596250067.0,1308721905645.0,1175216404790.0
39,Ảnh hưởng của chênh lệch tỷ giá,0.0,0.0,0.0,0.0,0.0,0.0,0.0,0.0,0.0,2656993872.0
40,Tiền và tương đương tiền cuối kỳ,232282631402.0,422234781061.0,213388374979.0,249812159909.0,192167536492.0,357670904557.0,2450596250067.0,1308721905645.0,1175216404790.0,879548130711.0
