,Unnamed: 0,Q3 2020,Q4 2020,Q1 2021,Q2 2021,Q3 2021,Q4 2021,Q1 2022,Q2 2022,Q3 2022,Q4 2022
0,Lưu chuyển tiền thuần từ các hoạt động sản xuất kinh doanh,106120050275.0,46369862087.0,-71814408014.0,83545533737.0,73326927939.0,-21160209809.0,-105060243525.0,80607104072.0,90718861029.0,-48432043363.0
1,Lãi/lỗ trước những thay đổi vốn lưu động,8788715969.0,21512860444.0,4645586936.0,50550171467.0,15824093572.0,2700220235.0,2874733995.0,55523019086.0,19223339605.0,17041178859.0
2,Lãi trước thuế,18717343886.0,9788401571.0,3549907148.0,40068434051.0,11660230606.0,10824009283.0,2302363717.0,41227999258.0,26044899373.0,23618989605.0
3,Khấu hao TSCĐ,1868906249.0,1822612968.0,1682276454.0,1557679604.0,1556420084.0,1688422424.0,1674612118.0,1046550090.0,1132790586.0,1131174810.0
4,Phân bổ lợi thế thương mại,0.0,0.0,0.0,0.0,0.0,0.0,0.0,0.0,0.0,0.0
5,Chi phí dự phòng,-12873979755.0,12371210495.0,0.0,10309961853.0,3565785015.0,-11874973520.0,0.0,14205473251.0,-6740864683.0,-1961217698.0
6,Lãi/(lỗ) chênh lệch tỷ giá chưa thực hiện,0.0,0.0,0.0,0.0,0.0,0.0,0.0,0.0,0.0,0.0
8,Lãi/(lỗ) từ hoạt động đầu tư,462392030.0,-3227066739.0,-1324164032.0,-1968221655.0,-1638381934.0,-2598023993.0,-1263287359.0,-1068564924.0,-1256927838.0,-5747767858.0
9,Chi phí lãi vay,614053559.0,757702149.0,737567366.0,582317614.0,680039801.0,4660786041.0,161045519.0,111561411.0,43442167.0,0.0
11,Các khoản điều chỉnh khác,0.0,0.0,0.0,0.0,0.0,0.0,0.0,0.0,0.0,0.0
12,(Tăng)/giảm các khoản phải thu,9892526791.0,172884106015.0,-13971098880.0,-214259998355.0,-33992694815.0,237113374615.0,3458107265.0,-239721972283.0,-134917085075.0,376364234733.0
13,(Tăng)/giảm hàng tồn kho,80442409377.0,-27701681682.0,-65853616601.0,49229101231.0,-1058661486.0,25047990105.0,-177452184621.0,24095529344.0,119899257281.0,-18361199303.0
14,Tăng/(giảm) các khoản phải trả,4469287376.0,-114169025674.0,16666573780.0,193277532432.0,95787047153.0,-273103731136.0,75338455383.0,246294316780.0,77438539724.0,-397868547474.0
15,( Tăng)/giảm chi phí trả trước,11079006482.0,-815611435.0,-8051427577.0,6316818827.0,6450349711.0,-4875347349.0,-1479328834.0,-4145139716.0,10904354841.0,-14633192465.0
16,(Tăng)/giảm chứng khoán kinh doanh,0.0,0.0,0.0,0.0,0.0,0.0,0.0,0.0,0.0,21500000.0
17,Chi phí lãi vay đã trả,-654700416.0,-716114888.0,-779154627.0,-551358954.0,-710998461.0,-4652302145.0,-169529415.0,-106925443.0,-48078135.0,0.0
18,Thuế thu nhập doanh nghiệp đã trả,-7503182102.0,-3778639523.0,-585821528.0,-618253425.0,-8420485517.0,-2344186210.0,-5900886204.0,-347645920.0,-359773296.0,-10348300536.0
19,Tiền thu khác từ các hoạt động kinh doanh,0.0,0.0,0.0,0.0,0.0,0.0,105000000.0,-105000000.0,125000000.0,-125000000.0
20,Tiền chi khác từ các hoạt động kinh doanh,-394013202.0,-846031170.0,-3885449517.0,-398479486.0,-551722218.0,-1046227924.0,-1834611094.0,-879077776.0,-1546693916.0,-522717177.0
21,Lưu chuyển tiền tệ ròng từ hoạt động đầu tư,13331348218.0,-14656097115.0,11147983224.0,1090914423.0,1428600423.0,1233633120.0,1513795634.0,-89391240.0,-820612135.0,12376782281.0
22,Tiền mua tài sản cố định và các tài sản dài hạn khác,0.0,0.0,0.0,0.0,0.0,-2625727818.0,0.0,-30636364.0,-2735132525.0,-103609091.0
23,Tiền thu được từ thanh lý tài sản cố định,0.0,90909091.0,0.0,300000000.0,0.0,136363636.0,0.0,0.0,0.0,8545554545.0
24,Tiền cho vay hoặc mua công cụ nợ,0.0,0.0,0.0,0.0,0.0,0.0,0.0,0.0,0.0,0.0
25,Tiền thu từ cho vay hoặc thu từ phát hành công cụ nợ,16369250000.0,-26369250000.0,10000000000.0,0.0,0.0,0.0,0.0,0.0,0.0,1000000000.0
26,Đầu tư vào các doanh nghiệp khác,0.0,0.0,0.0,0.0,0.0,0.0,0.0,0.0,0.0,0.0
27,Tiền thu từ việc bán các khoản đầu tư vào các doanh nghiệp khác,-3356200000.0,9492800000.0,0.0,0.0,0.0,0.0,0.0,0.0,0.0,0.0
28,Cổ tức và tiền lãi nhận được,318298218.0,2129443794.0,1147983224.0,790914423.0,1428600423.0,3722997302.0,1513795634.0,-58754876.0,1914520390.0,2934836827.0
29,Lưu chuyển tiền tệ từ hoạt động tài chính,6712954694.0,-4287761428.0,-18515619351.0,-10159712059.0,8113430437.0,-34282836761.0,-34106710258.0,11837550191.0,-11990550191.0,0.0
30,Tiền thu từ phát hành cổ phiếu và vốn góp,0.0,0.0,0.0,0.0,0.0,0.0,0.0,0.0,0.0,0.0
31,"Chi trả cho việc mua lại, trả lại cổ phiếu",0.0,0.0,0.0,0.0,0.0,0.0,0.0,0.0,0.0,0.0
32,Tiền thu được các khoản đi vay,95126793510.0,71094417774.0,87289012703.0,47956008884.0,40496745877.0,0.0,22079614482.0,11990550191.0,0.0,0.0
33,Tiển trả các khoản đi vay,-88413838816.0,-75382179202.0,-87804632054.0,-58013720943.0,-32383315440.0,-34384836761.0,-36686324740.0,0.0,-11990550191.0,0.0
34,Tiền thanh toán vốn gốc đi thuê tài chính,0.0,0.0,0.0,0.0,0.0,0.0,0.0,0.0,0.0,0.0
35,Cổ tức đã trả,0.0,0.0,-18000000000.0,-102000000.0,0.0,102000000.0,-19500000000.0,-153000000.0,0.0,0.0
37,Lưu chuyển tiền thuần trong kỳ,126164353187.0,27426003544.0,-79182044141.0,74476736101.0,82868958799.0,-54209413450.0,-137653158149.0,92355263023.0,77907698703.0,-36055261082.0
38,Tiền và tương đương tiền đầu kỳ,19024277779.0,145188630966.0,172955652798.0,93773608657.0,168250344758.0,251119303557.0,196909890107.0,59256731958.0,151611994981.0,229519693684.0
39,Ảnh hưởng của chênh lệch tỷ giá,0.0,0.0,0.0,0.0,0.0,0.0,0.0,0.0,0.0,0.0
40,Tiền và tương đương tiền cuối kỳ,145188630966.0,172614634510.0,93773608657.0,168250344758.0,251119303557.0,196909890107.0,59256731958.0,151611994981.0,229519693684.0,193464432602.0
