,Unnamed: 0,2013,2014,2015,2016,2017,2018,2019,2020,2021,2022
0,Lưu chuyển tiền thuần từ các hoạt động sản xuất kinh doanh,-2338965194.0,40545303044.0,37602077812.0,51442996441.0,23524569958.0,54443612312.0,55948288945.0,15576501991.0,24816235240.0,14894913132.0
1,Lãi/lỗ trước những thay đổi vốn lưu động,0.0,71864017003.0,68376785205.0,65053451634.0,74970109992.0,71587309334.0,54857802336.0,42111281756.0,29296654340.0,22454487797.0
2,Lãi trước thuế,0.0,47629856573.0,32726552364.0,30545384487.0,33726068799.0,36392961891.0,38851538653.0,38681630879.0,34133874451.0,27044235309.0
3,Khấu hao TSCĐ,0.0,34126117692.0,31400082933.0,33485392649.0,40042117757.0,35964549742.0,21081456113.0,8164263816.0,180999477.0,1087595421.0
5,Chi phí dự phòng,0.0,4465518664.0,182848694.0,0.0,0.0,0.0,0.0,767363973.0,-616201057.0,0.0
6,Lãi/(lỗ) chênh lệch tỷ giá chưa thực hiện,0.0,0.0,0.0,0.0,-4038215.0,0.0,0.0,0.0,0.0,8413651.0
8,Lãi/(lỗ) từ hoạt động đầu tư,0.0,-21218865438.0,-2179372427.0,-2368304721.0,-2952614258.0,-2808512981.0,-5075192430.0,-5501976912.0,-4402018531.0,-5685756584.0
9,Chi phí lãi vay,0.0,6861389512.0,6246673641.0,3390979219.0,4158575909.0,2038310682.0,0.0,0.0,0.0,0.0
11,Các khoản điều chỉnh khác,0.0,0.0,0.0,0.0,0.0,0.0,0.0,0.0,0.0,0.0
12,(Tăng)/giảm các khoản phải thu,0.0,-13729241596.0,-18937521516.0,-9334424122.0,-144814890415.0,113312652821.0,-3188110699.0,-12359388295.0,15365304487.0,15070603401.0
13,(Tăng)/giảm hàng tồn kho,0.0,19545441897.0,1298056412.0,-176909092.0,-1422765511.0,-2331678937.0,1212140084.0,-2772150120.0,4094555373.0,-501091735.0
14,Tăng/(giảm) các khoản phải trả,0.0,-24393714061.0,7428831218.0,12883043707.0,106291140366.0,-117414576106.0,8239999545.0,2764204925.0,-8070918238.0,-12811159176.0
15,( Tăng)/giảm chi phí trả trước,0.0,252130798.0,534961965.0,-2436180593.0,3085151105.0,-2974527010.0,4731996813.0,-1916449585.0,1066865450.0,550797975.0
16,(Tăng)/giảm chứng khoán kinh doanh,0.0,0.0,0.0,0.0,0.0,0.0,0.0,0.0,0.0,0.0
17,Chi phí lãi vay đã trả,0.0,-6862791819.0,-6210942356.0,-3357420886.0,-4191628744.0,-2074547465.0,0.0,0.0,0.0,0.0
18,Thuế thu nhập doanh nghiệp đã trả,0.0,-5637839178.0,-13863885116.0,-8226725362.0,-6698373121.0,-5661020325.0,-7839087755.0,-9696660787.0,-9417752477.0,-4813700543.0
19,Tiền thu khác từ các hoạt động kinh doanh,0.0,0.0,0.0,0.0,0.0,0.0,0.0,0.0,0.0,0.0
20,Tiền chi khác từ các hoạt động kinh doanh,0.0,-492700000.0,-1024208000.0,-2961838845.0,-3694173714.0,0.0,-2066451379.0,-2554335903.0,-7518473695.0,-5055024587.0
21,Lưu chuyển tiền tệ ròng từ hoạt động đầu tư,-31162204561.0,-23186487695.0,-2465746953.0,-50128012135.0,-4962363924.0,-22462957316.0,4698709808.0,10478148755.0,-75148874360.0,-19197872055.0
22,Tiền mua tài sản cố định và các tài sản dài hạn khác,-68922912705.0,-47708651132.0,-4524340298.0,-50237792169.0,-5596307904.0,-1767758091.0,0.0,0.0,-2907054545.0,-2283378787.0
23,Tiền thu được từ thanh lý tài sản cố định,0.0,23852871431.0,0.0,17080909.0,0.0,0.0,178486000.0,0.0,0.0,0.0
24,Tiền cho vay hoặc mua công cụ nợ,-446677778282.0,0.0,0.0,-37000000000.0,-45800000000.0,-23537640742.0,-287595609.0,0.0,-76500000000.0,-78500000000.0
25,Tiền thu từ cho vay hoặc thu từ phát hành công cụ nợ,476062778282.0,0.0,0.0,35000000000.0,43472227139.0,0.0,0.0,5000000000.0,1000000000.0,56500000000.0
26,Đầu tư vào các doanh nghiệp khác,0.0,0.0,0.0,0.0,0.0,0.0,0.0,0.0,0.0,0.0
27,Tiền thu từ việc bán các khoản đầu tư vào các doanh nghiệp khác,2505890518.0,0.0,0.0,0.0,0.0,0.0,0.0,0.0,0.0,0.0
28,Cổ tức và tiền lãi nhận được,5869817626.0,669292006.0,2058593345.0,2092699125.0,2961716841.0,2842441517.0,4807819417.0,5478148755.0,3258180185.0,5085506732.0
29,Lưu chuyển tiền tệ từ hoạt động tài chính,39951093956.0,20014656278.0,-40297949192.0,1962949461.0,-24777199477.0,-37960236640.0,-10497204200.0,-17461022500.0,-16821673375.0,-16838643875.0
30,Tiền thu từ phát hành cổ phiếu và vốn góp,0.0,0.0,0.0,1417920000.0,0.0,0.0,0.0,0.0,0.0,0.0
31,"Chi trả cho việc mua lại, trả lại cổ phiếu",0.0,0.0,0.0,0.0,0.0,0.0,0.0,0.0,0.0,0.0
32,Tiền thu được các khoản đi vay,80713083727.0,48804517821.0,0.0,35661000000.0,0.0,0.0,0.0,0.0,0.0,0.0
33,Tiển trả các khoản đi vay,-33472409771.0,-26713489343.0,-33133956992.0,-26025384539.0,-24739979477.0,-27652749640.0,0.0,0.0,0.0,0.0
34,Tiền thanh toán vốn gốc đi thuê tài chính,0.0,0.0,0.0,0.0,0.0,0.0,0.0,0.0,0.0,0.0
35,Cổ tức đã trả,-7289580000.0,-2076372200.0,-7163992200.0,-9090586000.0,-37220000.0,-10307487000.0,-10497204200.0,-17461022500.0,-16821673375.0,-16838643875.0
37,Lưu chuyển tiền thuần trong kỳ,6449924201.0,37373471627.0,-5161618333.0,3277933767.0,-6214993443.0,-5979581644.0,50149794553.0,8593628246.0,-67154312495.0,-21141602798.0
38,Tiền và tương đương tiền đầu kỳ,6687376049.0,29252300250.0,66625771877.0,61464153544.0,64742087311.0,58527093868.0,52547512224.0,102697306777.0,111290935023.0,44136622528.0
39,Ảnh hưởng của chênh lệch tỷ giá,0.0,0.0,0.0,0.0,0.0,0.0,0.0,0.0,0.0,-4849597.0
40,Tiền và tương đương tiền cuối kỳ,13137300250.0,66625771877.0,61464153544.0,64742087311.0,58527093868.0,52547512224.0,102697306777.0,111290935023.0,44136622528.0,22990170133.0
