,Unnamed: 0,2013,2014,2015,2016,2017,2018,2019,2020,2021,2022
0,Lưu chuyển tiền thuần từ các hoạt động sản xuất kinh doanh,-11233728335.0,590111644.0,2702001843.0,-26303428996.0,3496168582.0,10409703956.0,14117033391.0,26899432067.0,-2456584333.0,7579484482.0
1,Lãi/lỗ trước những thay đổi vốn lưu động,3616891429.0,11109074945.0,8218681924.0,10547142904.0,10943241778.0,13422928408.0,14869367765.0,18069964674.0,17949745096.0,15925255933.0
2,Lãi trước thuế,1598266674.0,2935455825.0,1463478585.0,2905258035.0,315522783.0,318069642.0,2432840011.0,7612462172.0,8756665491.0,7501633070.0
3,Khấu hao TSCĐ,373469597.0,3887431436.0,3954837151.0,4351827459.0,5255039006.0,8220264098.0,8546358772.0,8470136820.0,8378958157.0,7816165936.0
5,Chi phí dự phòng,212872539.0,0.0,-12202827.0,0.0,0.0,0.0,0.0,0.0,370157714.0,-360696844.0
6,Lãi/(lỗ) chênh lệch tỷ giá chưa thực hiện,0.0,0.0,-11805.0,0.0,0.0,0.0,0.0,0.0,9900000.0,-17123110.0
8,Lãi/(lỗ) từ hoạt động đầu tư,-634964802.0,-9491052.0,-795008679.0,-233075836.0,634513403.0,-35791037.0,-1036567.0,-2716510.0,-120241139.0,-196350309.0
9,Chi phí lãi vay,2067247421.0,4295678736.0,3595593459.0,3523133246.0,4738166586.0,4920385705.0,3891205549.0,1990082192.0,554304873.0,1181627190.0
11,Các khoản điều chỉnh khác,0.0,0.0,11996040.0,0.0,0.0,0.0,0.0,0.0,0.0,0.0
12,(Tăng)/giảm các khoản phải thu,-11232286405.0,-3811840146.0,-6681342783.0,-8347982826.0,-8303199561.0,193176075.0,11452785421.0,5813315580.0,-2903613569.0,-3861187397.0
13,(Tăng)/giảm hàng tồn kho,-4820662332.0,-3178709683.0,2082589490.0,-10302118797.0,1248348230.0,1641310061.0,3029522344.0,-6397913035.0,-8525576649.0,450628841.0
14,Tăng/(giảm) các khoản phải trả,4649256266.0,-1221983965.0,6163311299.0,-10047101254.0,5781494060.0,-288781422.0,-10731157452.0,11895225468.0,-5669197363.0,-2323784449.0
15,( Tăng)/giảm chi phí trả trước,-930487164.0,491750553.0,421120317.0,-497436240.0,-701070710.0,434127721.0,384618448.0,278642137.0,-1057943959.0,145923999.0
16,(Tăng)/giảm chứng khoán kinh doanh,0.0,0.0,-3614095544.0,0.0,0.0,0.0,0.0,0.0,0.0,0.0
17,Chi phí lãi vay đã trả,-2067247421.0,-4122836874.0,0.0,-3384273188.0,-4835848852.0,-4920385705.0,-3848170515.0,-2024551845.0,-491909881.0,-1227738064.0
18,Thuế thu nhập doanh nghiệp đã trả,-409192708.0,-308317222.0,-760205157.0,-264147874.0,-708647174.0,-72671182.0,-1039932620.0,-735250912.0,-1758088008.0,-1475412516.0
19,Tiền thu khác từ các hoạt động kinh doanh,0.0,2889601171.0,523651857.0,141886280.0,265491905.0,0.0,0.0,0.0,0.0,0.0
20,Tiền chi khác từ các hoạt động kinh doanh,-40000000.0,-1256627135.0,-3651709560.0,-4149398001.0,-193641094.0,0.0,0.0,0.0,0.0,-54201865.0
21,Lưu chuyển tiền tệ ròng từ hoạt động đầu tư,-28503835061.0,-3488796636.0,-1684064042.0,-4801110339.0,-7946214176.0,-2906558213.0,-95963433.0,2716510.0,-5879758861.0,-369435392.0
22,Tiền mua tài sản cố định và các tài sản dài hạn khác,-32698172793.0,-3498287688.0,-3178046936.0,-1187396717.0,-8851718648.0,-2944849250.0,-97000000.0,0.0,0.0,-561051500.0
23,Tiền thu được từ thanh lý tài sản cố định,4098818182.0,0.0,1483179474.0,323607084.0,800000000.0,27500000.0,0.0,0.0,0.0,0.0
24,Tiền cho vay hoặc mua công cụ nợ,0.0,0.0,0.0,-9045758320.0,0.0,0.0,0.0,0.0,-6000000000.0,0.0
25,Tiền thu từ cho vay hoặc thu từ phát hành công cụ nợ,0.0,0.0,0.0,5000000000.0,0.0,0.0,0.0,0.0,0.0,0.0
26,Đầu tư vào các doanh nghiệp khác,0.0,0.0,0.0,0.0,0.0,0.0,0.0,0.0,0.0,0.0
27,Tiền thu từ việc bán các khoản đầu tư vào các doanh nghiệp khác,0.0,0.0,0.0,0.0,0.0,0.0,0.0,0.0,0.0,0.0
28,Cổ tức và tiền lãi nhận được,95519550.0,9491052.0,10803420.0,108437614.0,105504472.0,10791037.0,1036567.0,2716510.0,120241139.0,191616108.0
29,Lưu chuyển tiền tệ từ hoạt động tài chính,39020922204.0,2938040766.0,-1974297949.0,35901248929.0,2023940219.0,-9918699800.0,-13218201303.0,-24963531072.0,7673505924.0,-6102097036.0
30,Tiền thu từ phát hành cổ phiếu và vốn góp,13922207000.0,0.0,0.0,23108750000.0,0.0,0.0,0.0,0.0,0.0,0.0
31,"Chi trả cho việc mua lại, trả lại cổ phiếu",0.0,0.0,0.0,0.0,0.0,0.0,0.0,0.0,0.0,0.0
32,Tiền thu được các khoản đi vay,41490000000.0,54988597674.0,41333269817.0,78643279589.0,86420531383.0,92087480633.0,71907545460.0,52666457011.0,48868340076.0,50132759580.0
33,Tiển trả các khoản đi vay,-16368000000.0,-51007338331.0,-42086483392.0,-64483644667.0,-82862375573.0,-100355616704.0,-85125746763.0,-77629988083.0,-41194834152.0,-56234856616.0
34,Tiền thanh toán vốn gốc đi thuê tài chính,0.0,-1043218577.0,-1221084374.0,-1367135993.0,-1534215591.0,-1650563729.0,0.0,0.0,0.0,0.0
35,Cổ tức đã trả,-23284796.0,0.0,0.0,0.0,0.0,0.0,0.0,0.0,0.0,0.0
37,Lưu chuyển tiền thuần trong kỳ,-716641192.0,39355774.0,-956360148.0,4796709594.0,-2426105375.0,-2415554057.0,802868655.0,1938617505.0,-662837270.0,1107952054.0
38,Tiền và tương đương tiền đầu kỳ,2669227666.0,1952586474.0,1991942248.0,1035593905.0,5832303499.0,3406198124.0,990644067.0,1793512722.0,3732130227.0,3069292957.0
39,Ảnh hưởng của chênh lệch tỷ giá,0.0,0.0,11805.0,0.0,0.0,0.0,0.0,0.0,0.0,0.0
40,Tiền và tương đương tiền cuối kỳ,1952586474.0,1991942248.0,1035593905.0,5832303499.0,3406198124.0,990644067.0,1793512722.0,3732130227.0,3069292957.0,4177245011.0
