,Unnamed: 0,2009,2010,2011,2012,2013,2014,2015,2016,2017,2018
0,Lưu chuyển tiền thuần từ các hoạt động sản xuất kinh doanh,-8650768486.0,-74437299322.0,45366818745.0,3979396476.0,-667836998.0,3129439891.0,24675327667.0,-1803815133.0,10664065.0,220093816.0
1,Lãi/lỗ trước những thay đổi vốn lưu động,0.0,58847529603.0,3469426513.0,-4633973594.0,259769999.0,-6699435609.0,-10150661593.0,-355405400.0,320089902.0,241983797.0
2,Lãi trước thuế,0.0,59013369828.0,-46898420428.0,-5152314510.0,115563408.0,-6746442121.0,-10277927631.0,-354742790.0,320512517.0,242225784.0
3,Khấu hao TSCĐ,6207142583.0,297222371.0,114570241.0,150563414.0,144394060.0,47041428.0,36230717.0,0.0,0.0,0.0
5,Chi phí dự phòng,0.0,546886110.0,26700702117.0,0.0,-187469.0,0.0,-11270.0,0.0,0.0,0.0
6,Lãi/(lỗ) chênh lệch tỷ giá chưa thực hiện,0.0,0.0,0.0,0.0,0.0,0.0,0.0,0.0,0.0,0.0
7,Lãi/(lỗ) từ thanh lý tài sản cố định,0.0,0.0,0.0,0.0,0.0,0.0,0.0,0.0,0.0,0.0
8,Lãi/(lỗ) từ hoạt động đầu tư,0.0,-1655850594.0,18257522652.0,-510091842.0,0.0,-34916.0,0.0,-662610.0,-422615.0,-241987.0
9,Chi phí lãi vay,0.0,645901888.0,5295051931.0,877869344.0,0.0,0.0,91046591.0,0.0,0.0,0.0
10,Thu lãi và cổ tức,0.0,0.0,0.0,0.0,0.0,0.0,0.0,0.0,0.0,0.0
11,Các khoản điều chỉnh khác,0.0,0.0,0.0,0.0,0.0,0.0,0.0,0.0,0.0,0.0
12,(Tăng)/giảm các khoản phải thu,0.0,-249194093544.0,-38342013235.0,10025691596.0,-1214994834.0,9390892064.0,-15520370813.0,-1151957464.0,-1136228798.0,393857668.0
13,(Tăng)/giảm hàng tồn kho,0.0,4706510513.0,571531925.0,-1416698645.0,2898933317.0,-190757132.0,-1275225442.0,-1017949886.0,677104110.0,-363636364.0
14,Tăng/(giảm) các khoản phải trả,0.0,123928674251.0,104364116497.0,-3074629726.0,-2599630479.0,621630568.0,53446183757.0,721497617.0,149698851.0,-56844189.0
15,( Tăng)/giảm chi phí trả trước,0.0,779972440.0,143624723.0,74658131.0,-11915001.0,7110000.0,1266448349.0,0.0,0.0,0.0
16,(Tăng)/giảm chứng khoán kinh doanh,0.0,0.0,0.0,0.0,0.0,0.0,0.0,0.0,0.0,0.0
17,Chi phí lãi vay đã trả,0.0,-390901888.0,-2609805551.0,-351043677.0,0.0,0.0,-91046591.0,0.0,0.0,0.0
18,Thuế thu nhập doanh nghiệp đã trả,0.0,-1012487304.0,0.0,0.0,0.0,0.0,-3000000000.0,0.0,0.0,0.0
19,Tiền thu khác từ các hoạt động kinh doanh,0.0,31563581594.0,2758710369.0,8357366902.0,0.0,0.0,0.0,0.0,0.0,500000000.0
20,Tiền chi khác từ các hoạt động kinh doanh,0.0,-43666084987.0,-24988772496.0,-5001974511.0,0.0,0.0,0.0,0.0,0.0,-495267096.0
21,Lưu chuyển tiền tệ ròng từ hoạt động đầu tư,5573431097.0,-5891752721.0,-59858817993.0,4824297721.0,870957833.0,-3181516920.0,111270.0,662610.0,322615.0,241987.0
22,Tiền mua tài sản cố định và các tài sản dài hạn khác,-141208905.0,-7547603315.0,-9501139224.0,-409601531.0,0.0,-3181551836.0,0.0,0.0,0.0,0.0
23,Tiền thu được từ thanh lý tài sản cố định,50000000.0,0.0,0.0,0.0,870770364.0,0.0,0.0,0.0,0.0,0.0
24,Tiền cho vay hoặc mua công cụ nợ,0.0,-132649337711.0,-56474289798.0,0.0,0.0,0.0,0.0,0.0,0.0,0.0
25,Tiền thu từ cho vay hoặc thu từ phát hành công cụ nợ,0.0,132649337711.0,6066383798.0,0.0,0.0,0.0,0.0,0.0,0.0,0.0
26,Đầu tư vào các doanh nghiệp khác,0.0,0.0,0.0,0.0,0.0,0.0,0.0,0.0,0.0,0.0
27,Tiền thu từ việc bán các khoản đầu tư vào các doanh nghiệp khác,5429140002.0,0.0,0.0,5233899252.0,0.0,0.0,0.0,0.0,0.0,0.0
28,Cổ tức và tiền lãi nhận được,235500000.0,1655850594.0,50227231.0,0.0,187469.0,34916.0,111270.0,662610.0,322615.0,241987.0
29,Lưu chuyển tiền tệ từ hoạt động tài chính,-4014802390.0,79079565214.0,14554955893.0,-11956201107.0,-40000000.0,-45000000.0,-22515117000.0,0.0,0.0,0.0
30,Tiền thu từ phát hành cổ phiếu và vốn góp,0.0,75000000000.0,11555320000.0,0.0,0.0,0.0,0.0,0.0,0.0,0.0
31,"Chi trả cho việc mua lại, trả lại cổ phiếu",0.0,0.0,0.0,0.0,0.0,0.0,0.0,0.0,0.0,0.0
32,Tiền thu được các khoản đi vay,10076426350.0,23669991724.0,17231906026.0,0.0,0.0,0.0,0.0,0.0,0.0,0.0
33,Tiển trả các khoản đi vay,-10088761240.0,-16340426510.0,-14232270133.0,-11956201107.0,-40000000.0,-45000000.0,-22515117000.0,0.0,0.0,0.0
34,Tiền thanh toán vốn gốc đi thuê tài chính,0.0,0.0,0.0,0.0,0.0,0.0,0.0,0.0,0.0,0.0
35,Cổ tức đã trả,-4002467500.0,-3250000000.0,0.0,0.0,0.0,0.0,0.0,0.0,0.0,0.0
36,Tiền lãi đã nhận,0.0,0.0,0.0,0.0,0.0,0.0,0.0,0.0,0.0,0.0
37,Lưu chuyển tiền thuần trong kỳ,-7092139779.0,-1249486829.0,62956645.0,-3152506910.0,163120835.0,-97077029.0,2160321937.0,-1803152523.0,10986680.0,220335803.0
38,Tiền và tương đương tiền đầu kỳ,11569881712.0,4477741933.0,3228255104.0,3291211749.0,138704839.0,301825674.0,204748645.0,2365070582.0,561918059.0,572904739.0
39,Ảnh hưởng của chênh lệch tỷ giá,0.0,0.0,0.0,0.0,0.0,0.0,0.0,0.0,0.0,0.0
40,Tiền và tương đương tiền cuối kỳ,4477741933.0,3228255104.0,3291211749.0,138704839.0,301825674.0,204748645.0,2365070582.0,561918059.0,572904739.0,793240542.0
