,Unnamed: 0,Q3 2020,Q4 2020,Q1 2021,Q2 2021,Q3 2021,Q4 2021,Q1 2022,Q2 2022,Q3 2022,Q4 2022
0,Lưu chuyển tiền thuần từ các hoạt động sản xuất kinh doanh,69467023177.0,49461303959.0,33030455509.0,33525577189.0,18626531859.0,49986684723.0,-40265995759.0,60950320826.0,300294925443.0,-39154494342.0
1,Lãi/lỗ trước những thay đổi vốn lưu động,39346856168.0,42793181853.0,36429802477.0,36951127751.0,28653999639.0,18308701498.0,24132727729.0,41015867475.0,32050637386.0,21761998622.0
2,Lãi trước thuế,3456265373.0,8002530684.0,273092780.0,7121180134.0,-3536397543.0,-9621193585.0,-690561541.0,4061144131.0,-358579051.0,-5279005819.0
3,Khấu hao TSCĐ,10670885306.0,11679120550.0,11687453543.0,11677370710.0,11304545653.0,11168325116.0,11135155630.0,11130007525.0,11127724200.0,11132235368.0
4,Phân bổ lợi thế thương mại,0.0,0.0,0.0,0.0,0.0,0.0,0.0,0.0,0.0,0.0
5,Chi phí dự phòng,-783547212.0,-3000000000.0,0.0,-2000000000.0,0.0,-4000000000.0,-2500000000.0,-303245615.0,0.0,0.0
6,Lãi/(lỗ) chênh lệch tỷ giá chưa thực hiện,0.0,0.0,0.0,-63604842.0,-36693423.0,80403630.0,-5112851.0,-241901.0,-17083217.0,-27878472.0
8,Lãi/(lỗ) từ hoạt động đầu tư,-1460301211.0,630320701.0,-1224477014.0,-2270350414.0,-1237243145.0,-879319360.0,-4024182871.0,-1068525454.0,-1243711134.0,-1967786662.0
9,Chi phí lãi vay,27463553912.0,25481209918.0,25693733168.0,22486532163.0,22159788097.0,21560485697.0,20217429362.0,27196728789.0,22542286588.0,17904434207.0
11,Các khoản điều chỉnh khác,0.0,0.0,0.0,0.0,0.0,0.0,0.0,0.0,0.0,0.0
12,(Tăng)/giảm các khoản phải thu,16610642480.0,26855096749.0,-23771384265.0,22418082419.0,-9175366923.0,29434719796.0,27330540513.0,67809646305.0,368455711465.0,43661759404.0
13,(Tăng)/giảm hàng tồn kho,1834875291.0,75248656904.0,-9904764963.0,51019988253.0,49684115468.0,72250429658.0,-34224568511.0,35716999304.0,-22111533909.0,-5817139981.0
14,Tăng/(giảm) các khoản phải trả,22585724246.0,-71364053178.0,49213603277.0,-51021347676.0,-26797042739.0,-41303892050.0,-27940188788.0,-73738690445.0,-55955893806.0,-74665880043.0
15,( Tăng)/giảm chi phí trả trước,14084280214.0,6660214641.0,2548125112.0,-400728230.0,-3009366469.0,481867351.0,-5868909911.0,6890828852.0,4601697400.0,-8255757023.0
16,(Tăng)/giảm chứng khoán kinh doanh,0.0,0.0,0.0,0.0,0.0,0.0,0.0,0.0,0.0,0.0
17,Chi phí lãi vay đã trả,-23242387930.0,-27382668891.0,-20702305010.0,-15682687989.0,-20225007117.0,-18970262518.0,-12894389303.0,-13390258768.0,-25482740130.0,-15372547218.0
18,Thuế thu nhập doanh nghiệp đã trả,-1031667292.0,-2028824119.0,-111621119.0,-9292457339.0,0.0,-9167529012.0,-10792207488.0,-2112071897.0,-1023142963.0,-177928103.0
19,Tiền thu khác từ các hoạt động kinh doanh,0.0,0.0,0.0,0.0,0.0,0.0,0.0,0.0,0.0,0.0
20,Tiền chi khác từ các hoạt động kinh doanh,-721300000.0,-1320300000.0,-671000000.0,-466400000.0,-504800000.0,-1047350000.0,-9000000.0,-1242000000.0,-239810000.0,-289000000.0
21,Lưu chuyển tiền tệ ròng từ hoạt động đầu tư,-25244079589.0,-61025208273.0,1450685694.0,1047013850.0,-28383601.0,3185756651.0,60392213712.0,-35366415854.0,17180229.0,17793722813.0
22,Tiền mua tài sản cố định và các tài sản dài hạn khác,-24999380800.0,-59701413745.0,-366160000.0,-135281818.0,-34540000.0,-284000000.0,-647272727.0,0.0,0.0,-1063221963.0
23,Tiền thu được từ thanh lý tài sản cố định,0.0,0.0,0.0,1027490909.0,0.0,500000000.0,3061917546.0,291691756.0,0.0,1648092421.0
24,Tiền cho vay hoặc mua công cụ nợ,0.0,0.0,0.0,0.0,0.0,0.0,0.0,0.0,0.0,0.0
25,Tiền thu từ cho vay hoặc thu từ phát hành công cụ nợ,0.0,0.0,2700000000.0,-700000000.0,0.0,3916625464.0,20801261000.0,-19301261000.0,0.0,2000000000.0
26,Đầu tư vào các doanh nghiệp khác,-1705000000.0,-860764000.0,-890073000.0,-1156968000.0,0.0,-1092091000.0,0.0,0.0,0.0,0.0
27,Tiền thu từ việc bán các khoản đầu tư vào các doanh nghiệp khác,0.0,0.0,0.0,0.0,0.0,0.0,0.0,20801261000.0,0.0,13482435306.0
28,Cổ tức và tiền lãi nhận được,1460301211.0,-463030528.0,6918694.0,2011772759.0,6156399.0,145222187.0,37176307893.0,-37158107610.0,17180229.0,1726417049.0
29,Lưu chuyển tiền tệ từ hoạt động tài chính,-24643800724.0,864787743.0,-10023938782.0,-53815485466.0,-26947312447.0,-35109379312.0,-30476899240.0,-21012841951.0,-235544677129.0,-21524912205.0
30,Tiền thu từ phát hành cổ phiếu và vốn góp,0.0,0.0,0.0,0.0,0.0,0.0,0.0,0.0,0.0,0.0
31,"Chi trả cho việc mua lại, trả lại cổ phiếu",0.0,0.0,0.0,0.0,0.0,0.0,0.0,0.0,0.0,0.0
32,Tiền thu được các khoản đi vay,142307687453.0,172846774357.0,163058793498.0,141547565175.0,144491076922.0,92875349843.0,77196327596.0,72214484003.0,61800104538.0,36423429863.0
33,Tiển trả các khoản đi vay,-166951488177.0,-171981986614.0,-168761250880.0,-192197706082.0,-171438389369.0,-122663247755.0,-107673226836.0,-93227325954.0,-286701819667.0,-57948342068.0
34,Tiền thanh toán vốn gốc đi thuê tài chính,0.0,0.0,0.0,0.0,0.0,0.0,0.0,0.0,0.0,0.0
35,Cổ tức đã trả,0.0,0.0,-4321481400.0,-3165344559.0,0.0,-5321481400.0,0.0,0.0,-10642962000.0,0.0
37,Lưu chuyển tiền thuần trong kỳ,19579142864.0,-10699116571.0,24457202421.0,-19242894427.0,-8349164189.0,18063062062.0,-10350681287.0,4571063021.0,64767428543.0,-42885683734.0
38,Tiền và tương đương tiền đầu kỳ,8345811215.0,27924954079.0,17225837508.0,41683039929.0,22440145502.0,14090981313.0,32154043375.0,21803362088.0,26374425109.0,91141853652.0
39,Ảnh hưởng của chênh lệch tỷ giá,0.0,0.0,0.0,0.0,0.0,0.0,0.0,0.0,0.0,0.0
40,Tiền và tương đương tiền cuối kỳ,27924954079.0,17225837508.0,41683039929.0,22440145502.0,14090981313.0,32154043375.0,21803362088.0,26374425109.0,91141853652.0,48256169918.0
